{
  "$schema": "./products.schema.json",
  "schema_version": 1,
  "catalog_version": "1.1.0",
  "metadata_as_of": "2026-08-20",
  "source": [
    "api/index.py",
    "src/App.jsx",
    "Eastmoney pingzhongdata/tsdata pages"
  ],
  "merge_policy": "backend_preferred_frontend_union",
  "metadata": {
    "source_diff": {
      "backend_products": 70,
      "frontend_products": 73,
      "union_products": 73,
      "shared_products": 70,
      "backend_only_count": 0,
      "backend_only_codes": [],
      "frontend_only_count": 3,
      "frontend_only_codes": [
        "000043",
        "016664",
        "501312"
      ],
      "conflicting_products": 47,
      "conflicting_fields": 69,
      "conflicts_by_field": {
        "buy_status": 6,
        "daily_limit": 31,
        "market_price": 16,
        "nav": 16
      }
    },
    "units": {
      "annual_return_2025": "percent",
      "scale": "CNY_100M",
      "fee": "annual_percent",
      "track_error": "annual_percent",
      "premium": "percent",
      "volume": "CNY_100M",
      "change_pct": "percent"
    }
  },
  "products": [
    {
      "code": "000043",
      "name": "嘉实美国成长股票(QDII)",
      "product_type": "fund",
      "categories": [
        "us_active"
      ],
      "share_class": "unspecified",
      "master_code": "000043",
      "related_share_codes": [],
      "tracking_index": null,
      "static_snapshot": {
        "annual_return_2025": 15.65,
        "scale": 50.96,
        "fee": 1.4,
        "track_error": null,
        "daily_limit": "100元",
        "subscription_status": "open",
        "premium": null,
        "volume": null,
        "change_pct": null,
        "market_price": null,
        "nav": null,
        "scale_as_of": "2026-06-30",
        "annual_return_2025_as_of": "2025-12-31",
        "metadata_fetched_at": "2026-08-20"
      },
      "metadata_as_of": "2026-06-30",
      "source": [
        "src/App.jsx:FALLBACK"
      ]
    },
    {
      "code": "000834",
      "name": "大成纳斯达克100指数(QDII)A",
      "product_type": "fund",
      "categories": [
        "nasdaq_passive"
      ],
      "share_class": "A",
      "master_code": "000834",
      "related_share_codes": [
        "008971"
      ],
      "tracking_index": null,
      "static_snapshot": {
        "annual_return_2025": 14.36,
        "scale": 59.97,
        "fee": 1.0,
        "track_error": 1.03,
        "daily_limit": "100元",
        "subscription_status": "open",
        "premium": null,
        "volume": null,
        "change_pct": null,
        "market_price": null,
        "nav": null,
        "scale_as_of": "2026-06-30",
        "annual_return_2025_as_of": "2025-12-31",
        "track_error_as_of": "2026-08-18",
        "metadata_fetched_at": "2026-08-20"
      },
      "metadata_as_of": "2026-06-30",
      "source": [
        "api/index.py:STATIC_FUNDS",
        "src/App.jsx:FALLBACK"
      ]
    },
    {
      "code": "001668",
      "name": "汇添富全球移动互联混合(QDII)A",
      "product_type": "fund",
      "categories": [
        "us_active"
      ],
      "share_class": "A",
      "master_code": "001668",
      "related_share_codes": [],
      "tracking_index": null,
      "static_snapshot": {
        "annual_return_2025": 18.7,
        "scale": 26.29,
        "fee": 1.4,
        "track_error": null,
        "daily_limit": "5000元",
        "subscription_status": "open",
        "premium": null,
        "volume": null,
        "change_pct": null,
        "market_price": null,
        "nav": null,
        "scale_as_of": "2026-06-30",
        "annual_return_2025_as_of": "2025-12-31",
        "metadata_fetched_at": "2026-08-20"
      },
      "metadata_as_of": "2026-06-30",
      "source": [
        "api/index.py:STATIC_FUNDS",
        "src/App.jsx:FALLBACK"
      ]
    },
    {
      "code": "002891",
      "name": "华夏移动互联灵活配置混合(QDII)A",
      "product_type": "fund",
      "categories": [
        "us_active"
      ],
      "share_class": "A",
      "master_code": "002891",
      "related_share_codes": [],
      "tracking_index": null,
      "static_snapshot": {
        "annual_return_2025": 20.88,
        "scale": 40.69,
        "fee": 1.4,
        "track_error": null,
        "daily_limit": "1000元",
        "subscription_status": "open",
        "premium": null,
        "volume": null,
        "change_pct": null,
        "market_price": null,
        "nav": null,
        "scale_as_of": "2026-06-30",
        "annual_return_2025_as_of": "2025-12-31",
        "metadata_fetched_at": "2026-08-20"
      },
      "metadata_as_of": "2026-06-30",
      "source": [
        "api/index.py:STATIC_FUNDS",
        "src/App.jsx:FALLBACK"
      ]
    },
    {
      "code": "004877",
      "name": "汇添富全球医疗混合(QDII)人民币",
      "product_type": "fund",
      "categories": [
        "us_active"
      ],
      "share_class": "unspecified",
      "master_code": "004877",
      "related_share_codes": [],
      "tracking_index": null,
      "static_snapshot": {
        "annual_return_2025": 28.53,
        "scale": 5.24,
        "fee": 1.4,
        "track_error": null,
        "daily_limit": "10000元",
        "subscription_status": "open",
        "premium": null,
        "volume": null,
        "change_pct": null,
        "market_price": null,
        "nav": null,
        "scale_as_of": "2026-06-30",
        "annual_return_2025_as_of": "2025-12-31",
        "metadata_fetched_at": "2026-08-20"
      },
      "metadata_as_of": "2026-06-30",
      "source": [
        "api/index.py:STATIC_FUNDS",
        "src/App.jsx:FALLBACK"
      ]
    },
    {
      "code": "005698",
      "name": "华夏全球科技先锋混合(QDII)",
      "product_type": "fund",
      "categories": [
        "us_active"
      ],
      "share_class": "unspecified",
      "master_code": "005698",
      "related_share_codes": [],
      "tracking_index": null,
      "static_snapshot": {
        "annual_return_2025": 15.49,
        "scale": 203.24,
        "fee": 1.4,
        "track_error": null,
        "daily_limit": "5000元",
        "subscription_status": "open",
        "premium": null,
        "volume": null,
        "change_pct": null,
        "market_price": null,
        "nav": null,
        "scale_as_of": "2026-06-30",
        "annual_return_2025_as_of": "2025-12-31",
        "metadata_fetched_at": "2026-08-20"
      },
      "metadata_as_of": "2026-06-30",
      "source": [
        "api/index.py:STATIC_FUNDS",
        "src/App.jsx:FALLBACK"
      ]
    },
    {
      "code": "006308",
      "name": "汇添富全球消费混合(QDII)人民币A",
      "product_type": "fund",
      "categories": [
        "us_active"
      ],
      "share_class": "A",
      "master_code": "006308",
      "related_share_codes": [
        "006309"
      ],
      "tracking_index": null,
      "static_snapshot": {
        "annual_return_2025": 11.28,
        "scale": 4.08,
        "fee": 1.4,
        "track_error": null,
        "daily_limit": "1000元",
        "subscription_status": "open",
        "premium": null,
        "volume": null,
        "change_pct": null,
        "market_price": null,
        "nav": null,
        "scale_as_of": "2026-06-30",
        "annual_return_2025_as_of": "2025-12-31",
        "metadata_fetched_at": "2026-08-20"
      },
      "metadata_as_of": "2026-06-30",
      "source": [
        "api/index.py:STATIC_FUNDS",
        "src/App.jsx:FALLBACK"
      ]
    },
    {
      "code": "006309",
      "name": "汇添富全球消费混合(QDII)人民币C",
      "product_type": "fund",
      "categories": [
        "us_active"
      ],
      "share_class": "C",
      "master_code": "006308",
      "related_share_codes": [
        "006308"
      ],
      "tracking_index": null,
      "static_snapshot": {
        "annual_return_2025": 10.18,
        "scale": 4.08,
        "fee": 1.4,
        "track_error": null,
        "daily_limit": "1000元",
        "subscription_status": "open",
        "premium": null,
        "volume": null,
        "change_pct": null,
        "market_price": null,
        "nav": null,
        "scale_as_of": "2026-06-30",
        "annual_return_2025_as_of": "2025-12-31",
        "metadata_fetched_at": "2026-08-20"
      },
      "metadata_as_of": "2026-06-30",
      "source": [
        "api/index.py:STATIC_FUNDS",
        "src/App.jsx:FALLBACK"
      ]
    },
    {
      "code": "006373",
      "name": "国富全球科技互联混合(QDII)人民币A",
      "product_type": "fund",
      "categories": [
        "us_active"
      ],
      "share_class": "A",
      "master_code": "006373",
      "related_share_codes": [],
      "tracking_index": null,
      "static_snapshot": {
        "annual_return_2025": 26.71,
        "scale": 89.61,
        "fee": 1.4,
        "track_error": null,
        "daily_limit": "100元",
        "subscription_status": "open",
        "premium": null,
        "volume": null,
        "change_pct": null,
        "market_price": null,
        "nav": null,
        "scale_as_of": "2026-06-30",
        "annual_return_2025_as_of": "2025-12-31",
        "metadata_fetched_at": "2026-08-20"
      },
      "metadata_as_of": "2026-06-30",
      "source": [
        "api/index.py:STATIC_FUNDS",
        "src/App.jsx:FALLBACK"
      ]
    },
    {
      "code": "006555",
      "name": "浦银安盛全球智能科技股票(QDII)A",
      "product_type": "fund",
      "categories": [
        "us_active"
      ],
      "share_class": "A",
      "master_code": "006555",
      "related_share_codes": [],
      "tracking_index": null,
      "static_snapshot": {
        "annual_return_2025": 22.49,
        "scale": 49.69,
        "fee": 1.4,
        "track_error": null,
        "daily_limit": "暂停申购",
        "subscription_status": "suspended",
        "premium": null,
        "volume": null,
        "change_pct": null,
        "market_price": null,
        "nav": null,
        "scale_as_of": "2026-06-30",
        "annual_return_2025_as_of": "2025-12-31",
        "metadata_fetched_at": "2026-08-20"
      },
      "metadata_as_of": "2026-06-30",
      "source": [
        "api/index.py:STATIC_FUNDS",